{
  "contract_id": "api.project.v1",
  "owner_session": "backend",
  "consumer_sessions": ["frontend_components", "docs_security_integration"],
  "status": "accepted",
  "breaking_change": false,
  "response_shape": {
    "project_id": "string",
    "display_name": "string"
  },
  "requires_review": ["frontend_components", "docs_security_integration"]
}
